{
  "commands": [
    "alter hds",
    "corpus audit",
    "coverage",
    "create hds",
    "extract sfz file",
    "extract wav file",
    "info",
    "inventory",
    "objects",
    "orphans",
    "relationships",
    "validate"
  ],
  "fixtures": [
    {
      "path": "tests/fixtures/images/sampler-authored/HD00_512_multi_sbnk_authored.hds",
      "sha256": "733b25eb1b9da4b155ec543f48e0c0f3ab5480dbba587ee80fea5df40dfa0d7d",
      "size_bytes": 1048576
    },
    {
      "path": "tests/fixtures/images/sampler-authored/HD00_512_single_sbnk_authored.hds",
      "sha256": "9604f208c23360f2b69c78bc7ae94cf9f9c12cf96ffddb3567dfadd8200cc816",
      "size_bytes": 1048576
    },
    {
      "path": "tests/fixtures/images/sampler-authored/MANIFEST.json",
      "sha256": "18f0499db0638881af15a9b510e5c4686e1758e86440e9764f3efa1ce0f9fc8f",
      "size_bytes": 1437
    }
  ],
  "oracle": {
    "git_commit": "62d6ce2dfe7dd1c85ece5cdf459a25a0a8deb5d3",
    "implementation": "python",
    "lock_sha256": "2191a0009bbe3f0b01093b3d0ecc5bb0191fb10b214bf2a74b7e0934da907dd3",
    "python_version": "3.13",
    "test_count": 430
  },
  "schema_version": "1.0",
  "writer_profiles": [
    "alteration_full_chain_v1",
    "alteration_rename_v1",
    "hds_geometry_v1",
    "sbac_prog_v1",
    "sbnk_mono_stereo_v1",
    "smpl_audio_import_v1"
  ]
}
